"question","answer"
"What is Art?","Art has always been an important form of human expression, allowing individuals to communicate their thoughts, emotions, and experiences through creative means. Whether it's through painting, sculpture, photography, or any other medium, art provides a way for individuals to express themselves and connect with others.

One of the key aspects of art as a form of expression is its ability to convey meaning and emotions in a nonverbal way. Through color, shape, texture, and composition, artists can create works that evoke a range of emotions, from joy and beauty to sadness and anger. Art can be deeply personal, reflecting the individual artist's experiences, beliefs, and values, but it can also be universal, speaking to broader themes and emotions that resonate with a wide audience."
"What is the most famous artwork of all time?","The most famous painting is Mona Lisa painted by Leonardo da Vinci. The portrait of Lisa del Giocondo was completed some time between 1503-1519 and on display at the Musee du Louvre in Paris since 1804."
"What are different genres of painting?","There is a huge range of different styles that are incorporated into art, with some having subtle differences between them to bold, striking changes that are easy to spot. There are some of the most popular types of painting art styles you’ll see in the modern day-  Realism, Photorealism, Expressism, Impressism,  Surrealism, Abstract, Pop Art. "
"List some of the famous artists","Some famous artists are - Leonardo da Vinci, Michelangelo, Rembrandt, Vermeer, Jean-Antoine Watteau"
"Can you tell about a famous artist working today","Yayoi Kusama (born 1929) is one of the most famous artists working today. tarting as a child, the Japanese artist began to suffer from hallucinations that manifested as flashes of light or auras, as well as fields of dots and flowers that talked to her. These experiences have provided the inspiration for her work, including the mirrored “Infinity Rooms” along with paintings, sculptures and installations that employ vivid, phantasmagorical patterns of polka dots and other motifs."
"Tell me more about art gallery","An art gallery is an exhibition space to display and sell artworks. The art gallery is a commercial enterprise working with a portfolio of artists. The gallery acts as the dealer representing, supporting, and distributing the artworks by the artists in question. an art gallery is a commercial and private enterprise. They curate exhibitions with the exhibited works available for sale. On the other hand, the museum is a public and non-commercial institution. Their exhibition program has an educational and cultural objective, canonizing and preserving the most relevant artworks and the exhibited artworks are not for sale."
"Suggest some best art exhibition to see in 2023","Here are some exhibitions you can see this year:  1. ""Celebrating Picasso"" at various galleries in Madrid to mark the fiftieth anniversary of the death of art titan Pablo Picasso. 2. ""Yayoi Kusama: 1945 to Now"" at M+, Hong Kong is blindingly colourful and bewilderingly pattern-filled. 3. ""Vermeer"" at Rijksmuseum in Amsterdam. It will be the largest Vermeer exhibition ever, bringing together more than 23 of the baroque painter’s masterpieces, that does include ‘Girl with a Pearl Earring’. 4. ""After Impressionism: Inventing Modern Art"" at National Gallery in London. The decades between 1880 and the outbreak of World War One in 1914 saw huge changes overhaul the art world and everything will be included in this exhibition."
"Which are some of the biggest art galleries?","The biggest art gallery in the world is Gagosian Gallery, covering over 20.000 square meters of exhibition space. It has more than 300 workers across New York (6 galleries), London (3 galleries), Beverly Hills, Paris, Le Bourget, Geneva, Basel, Rome, Athens, and Hong Kong.
In the second place, Hauser & Wirth established in 1992 in an Art Deco villa in Zurich, Switzerland. Hauser & Wirth is an active contributor to academic research – strongly connected to their specialized publishing activities. Another industry-leading international mega-gallery is Pace. Pace Gallery was founded in 1960 by Arne Glimcher in Boston."
"What are some artworks by Leonardo da Vinci?","The original Renaissance Man, Leonardo is identified with genius, not only for masterpieces such as the Mona Lisa (the title for which has entered the language as a superlative), The Last Supper and The Lady with an Ermine, but also for his drawings of technologies (aircraft, tanks, automobile) that were five hundred years in the future."
"Tell me more about Vincent Van Gogh and his artwork","Van Gogh is Dutch Post-Impressionist artist considered to be one of the greatest painters of all time. Born in 1853, Van Gogh created around 2,100 artworks despite having had no formal training. He took up painting when he was sacked, aged 27. He famously cut off his own ear after an argument with the artist Paul Gaugin. The artist’s iconic Starry Night painting was made in the Saint-Paul-de-Mausole psychiatric hospital. Unfortunately, Van Gogh took his own life aged only 37. Famous Van Gogh paintings: The Starry Night, Bedroom in Arles, Irises, Self-Portrait with Bandaged Ear, The Night Café."
"Can you tell about any art movements","There have been many art movements throughout history that have influenced and shaped the art world. Here are a few notable ones:
1.Renaissance (14th to 17th century) - A period of cultural and artistic rebirth in Europe, characterized by a renewed interest in classical antiquity, scientific inquiry, and humanism.
2.Baroque (17th century) - A grand and theatrical style that emerged in Europe as a reaction to the austerity of the Protestant Reformation. It is characterized by elaborate ornamentation, dramatic lighting, and a sense of movement and energy.
3.Rococo (18th century) - A more lighthearted and decorative style that emerged in France during the reign of Louis XV. It is characterized by delicate pastel colors, playful ornamentation, and a focus on leisurely pursuits.
4.Romanticism (late 18th to mid-19th century) - A movement that emphasized individualism, emotion, and imagination. It was characterized by a fascination with nature, the sublime, and the supernatural.
5.Impressionism (late 19th century) - A movement that sought to capture the fleeting sensations and effects of light on the landscape. It is characterized by loose brushwork, bright colors, and a focus on capturing the momentary and transient.
6.Expressionism (early 20th century) - A movement that sought to express subjective emotions and experiences through art. It is characterized by distorted forms, vivid colors, and a sense of psychological intensity.
7.Surrealism (1920s to 1940s) - A movement that sought to unlock the power of the subconscious mind and the imagination. It is characterized by dreamlike imagery, unexpected juxtapositions, and a sense of the uncanny."
"Tell about Art history and its evolution over time","Art history is the study of the development and evolution of art over time. It examines the various styles, movements, and techniques that have emerged in different cultures and periods, as well as the social, cultural, and political contexts that have influenced artistic production.
Art history is typically divided into different periods, which are characterized by distinctive styles, themes, and techniques. Some of the most well-known periods include:

1. Ancient art - art from prehistoric times to the fall of the Roman Empire in the 5th century CE.
2. Medieval art - art from the fall of the Roman Empire to the beginning of the Renaissance in the 14th century.
3.Renaissance art - art from the 14th to the 17th century, characterized by a renewed interest in classical antiquity, humanism, and scientific inquiry.
4.Baroque art - art from the 17th century, characterized by grandeur, drama, and ornate decoration.
5.Rococo art - art from the 18th century, characterized by playful ornamentation, pastel colors, and a focus on leisurely pursuits.
6.Modern art - art from the late 19th century to the mid-20th century, characterized by a rejection of traditional forms and techniques, and an emphasis on individual expression and experimentation.
7.Contemporary art - art from the mid-20th century to the present day, characterized by a diverse range of styles and media, and an ongoing exploration of new forms and ideas.
Art history also involves the study of individual artists, their biographies, and their contributions to the art world. It encompasses a wide range of disciplines, including art theory, aesthetics, philosophy, anthropology, and sociology."
"Mention few artworks/paintings","There are countless famous artworks that have left an indelible mark on the art world and continue to inspire and captivate audiences today. Here are just a few examples:

1. The Starry Night by Vincent van Gogh - a post-impressionist painting of a night sky, known for its swirling, dreamlike composition.
2. The Scream by Edvard Munch - an expressionist painting that captures the psychological anguish and existential despair of modern life.
3. Guernica by Pablo Picasso - a cubist painting that depicts the horrors of war, inspired by the bombing of the Spanish town of Guernica during the Spanish Civil War.
4.Les Demoiselles d'Avignon by Pablo Picasso - a groundbreaking work of cubism that shattered traditional notions of perspective and representation.
5.The Last Supper by Leonardo da Vinci - a fresco painting that depicts the final meal shared by Jesus and his disciples, renowned for its composition and use of perspective."
"What is contemporary art and current trends going?","Contemporary art refers to art created in the present time, which reflects the current cultural, social, and political climate. Contemporary art is often experimental and diverse, and it encompasses a wide range of styles and mediums, including painting, sculpture, installation, performance, and digital art.

Some current trends in contemporary art include: Environmental art, Political art, Digital art, Performance art, Abstract art, Conceptual art, Street art. Contemporary art is constantly evolving, and new styles and mediums are emerging all the time, reflecting the ever-changing cultural landscape."
"Explain the role of art in society","Art has always played an important role in society, serving as a means of expression, reflection, and social commentary. Here are some of the ways in which art contributes to society:
1. Art promotes cultural understanding and diversity.
2. Art serves as a form of social and political commentary.
3. Art promotes creativity and innovation, means of personal expression and growth.
4.Art contributes to the economy."
"The business of art and the art market","1. Auction houses: Auction houses such as Christie's and Sotheby's are major players in the art market, facilitating the buying and selling of artwork at high prices. 
2. Art galleries: Art galleries represent artists and sell their work to collectors and buyers. 
3. Art fairs: Art fairs are large-scale events where galleries and collectors gather to showcase and sell artwork. These events can be major sources of revenue for galleries and artists, with some fairs attracting thousands of visitors and generating millions of dollars in sales.
4. Art advisors: Art advisors work with collectors to build their collections and make informed decisions about buying and selling artwork. These advisors often have expertise in specific areas of the art world and can provide valuable insights and guidance to collectors.
5. Art investment: Some collectors and investors view artwork as a form of investment, buying and selling pieces with the aim of earning a profit. "
"Give me some facts about art","1. The world's most expensive painting ever sold at auction is Leonardo da Vinci's ""Salvator Mundi,"" which sold for $450.3 million in 2017.
2. The world's largest mural is located in Mexico City and was created by artist Diego Rivera. It measures 72 meters long by 8 meters high.
3. The world's largest sculpture is the Spring Temple Buddha in China, which stands at 128 meters tall (420 feet).
4. Vincent van Gogh only sold one painting during his lifetime, but today his paintings are some of the most sought-after and valuable in the world.
"
